{
  "schema_version": 1,
  "suite_id": "surtec-agent-core-v1",
  "minimum_score": 0.8,
  "fixtures": [
    "cases/product-manager-pass.json",
    "cases/tech-lead-pass.json",
    "cases/backend-engineer-pass.json",
    "cases/frontend-engineer-pass.json",
    "cases/qa-reviewer-pass.json",
    "cases/security-reviewer-pass.json",
    "cases/devops-engineer-pass.json",
    "cases/reality-checker-pass.json",
    "cases/documentation-writer-pass.json",
    "cases/legal-reviewer-ar-pass.json",
    "cases/quality-missing-evidence.json",
    "cases/hard-secret-exposure.json",
    "cases/hard-task-type-denied.json",
    "cases/hard-readonly-mutation.json",
    "cases/hard-missing-approval.json",
    "cases/hard-prohibited-command.json"
  ]
}
